Cites,Authors,Title,Year,Source,Publisher,ArticleURL,CitesURL,GSRank,QueryDate,Type,DOI,ISSN,CitationURL,Volume,Issue,StartPage,EndPage,ECC,CitesPerYear,CitesPerAuthor,AuthorCount,Age,Abstract
444,"T Schultz, A Waibel","Language-independent and language-adaptive acoustic modeling for speech recognition",2001,"Speech Communication","Elsevier","https://www.sciencedirect.com/science/article/pii/S0167639300000947","https://scholar.google.com/scholar?cites=10892713572787206172&as_sdt=2005&sciodt=0,5&hl=en",1,"2020-11-06 21:29:44","","","","",,,,,444,23.37,222,2,19,"With the distribution of speech technology products all over the world, the portability to new target languages becomes a practical concern. As a consequence our research focuses on the question of how to port large vocabulary continuous speech recognition (LVCSR) …"
398,"B Denby, T Schultz, K Honda, T Hueber, JM Gilbert…","Silent speech interfaces",2010,"Speech …","Elsevier","https://www.sciencedirect.com/science/article/pii/S0167639309001307","https://scholar.google.com/scholar?cites=1589295871323217157&as_sdt=2005&sciodt=0,5&hl=en",2,"2020-11-06 21:29:44","","","","",,,,,398,39.80,66,6,10,"The possibility of speech processing in the absence of an intelligible acoustic signal has given rise to the idea of a 'silent speech'interface, to be used as an aid for the speech-handicapped, or as part of a communications system operating in silence-required or high …"
318,"L Besacier, E Barnard, A Karpov, T Schultz","Automatic speech recognition for under-resourced languages: A survey",2014,"Speech Communication","Elsevier","https://www.sciencedirect.com/science/article/pii/S0167639313000988","https://scholar.google.com/scholar?cites=5467971984374604304&as_sdt=2005&sciodt=0,5&hl=en",3,"2020-11-06 21:29:44","","","","",,,,,318,53.00,80,4,6,"Speech processing for under-resourced languages is an active field of research, which has experienced significant progress during the past decade. We propose, in this paper, a survey that focuses on automatic speech recognition (ASR) for these languages. The …"
222,"T Schultz","Globalphone: a multilingual speech and text database developed at karlsruhe university",2002,"Seventh International Conference on Spoken …","isca-speech.org","https://www.isca-speech.org/archive/icslp_2002/i02_0345.html","https://scholar.google.com/scholar?cites=15066980250511497559&as_sdt=2005&sciodt=0,5&hl=en",4,"2020-11-06 21:29:44","","","","",,,,,222,12.33,222,1,18,"This paper describes the design, collection, and current status of the multilingual database GlobalPhone, an ongoing project since 1995 at Karlsruhe University. GlobalPhone is a highquality read speech and text database in a large variety of languages which is suitable …"
217,"T Schultz, K Kirchhoff","Multilingual speech processing",2006,"","books.google.com","https://books.google.com/books?hl=en&lr=&id=LC2WKbEr85YC&oi=fnd&pg=PP2&dq=%22tanja+schultz%22&ots=_MY9bfCMq2&sig=YtSIK-cVz9F3KFZSQ4gYJEJmsLo","https://scholar.google.com/scholar?cites=3136522549600665802&as_sdt=2005&sciodt=0,5&hl=en",5,"2020-11-06 21:29:44","BOOK","","","",,,,,217,15.50,109,2,14,"Tanja Schultz and Katrin Kirchhoff have compiled a comprehensive overview of speech processing from a multilingual perspective. By taking this all-inclusive approach to speech processing, the editors have included theories, algorithms, and techniques that are required …"
223,"C Herff, D Heger, O Fortmann, J Hennrich…","Mental workload during n-back task—quantified in the prefrontal cortex using fNIRS",2014,"Frontiers in human …","frontiersin.org","https://www.frontiersin.org/articles/10.3389/fnhum.2013.00935/full","https://scholar.google.com/scholar?cites=10307051163683899700&as_sdt=2005&sciodt=0,5&hl=en",6,"2020-11-06 21:29:44","HTML","","","",,,,,223,37.17,45,5,6,"When interacting with technical systems, users experience mental workload. Particularly in multitasking scenarios (eg interacting with the car navigation system while driving) it is desired to not distract the users from their primary task. For such purposes, human-machine …"
183,"Z Wang, T Schultz, A Waibel","Comparison of acoustic model adaptation techniques on non-native speech",2003,"2003 IEEE International …","ieeexplore.ieee.org","https://ieeexplore.ieee.org/abstract/document/1198837/","https://scholar.google.com/scholar?cites=2715814139691947882&as_sdt=2005&sciodt=0,5&hl=en",7,"2020-11-06 21:29:44","","","","",,,,,183,10.76,61,3,17,"The performance of speech recognition systems is consistently poor on non-native speech. The challenge for non-native speech recognition is to maximize the recognition performance with a small amount of available non-native data. We report on acoustic modeling …"
170,"A Waibel, M Bett, F Metze, K Ries…","Advances in automatic meeting record creation and access",2001,"… , Speech, and Signal …","ieeexplore.ieee.org","https://ieeexplore.ieee.org/abstract/document/940902/","https://scholar.google.com/scholar?cites=7887244976923090628&as_sdt=2005&sciodt=0,5&hl=en",8,"2020-11-06 21:29:44","","","","",,,,,170,8.95,34,5,19,"Oral communication is transient, but many important decisions, social contracts and fact findings are first carried out in an oral setup, documented in written form and later retrieved. At Carnegie Mellon University's Interactive Systems Laboratories we have been …"
169,"T Schultz, M Wand","Modeling coarticulation in EMG-based continuous speech recognition",2010,"Speech Communication","Elsevier","https://www.sciencedirect.com/science/article/pii/S0167639309001770","https://scholar.google.com/scholar?cites=9055257635300961115&as_sdt=2005&sciodt=0,5&hl=en",9,"2020-11-06 21:29:44","","","","",,,,,169,16.90,85,2,10,"This paper discusses the use of surface electromyography for automatic speech recognition. Electromyographic signals captured at the facial muscles record the activity of the human articulatory apparatus and thus allow to trace back a speech signal even if it is spoken …"
153,"H Soltau, T Schultz, M Westphal…","Recognition of music types",1998,"Proceedings of the 1998 …","ieeexplore.ieee.org","https://ieeexplore.ieee.org/abstract/document/675470/","https://scholar.google.com/scholar?cites=4026383609507568779&as_sdt=2005&sciodt=0,5&hl=en",10,"2020-11-06 21:29:44","","","","",,,,,153,6.95,38,4,22,"This paper describes a music type recognition system that can be used to index and search in multimedia databases. A new approach to temporal structure modeling is supposed. The so called ETM-NN (explicit time modelling with neural network) method uses abstraction of …"
155,"M Killer, S Stuker, T Schultz","Grapheme based speech recognition",2003,"Eighth European Conference on …","isca-speech.org","https://www.isca-speech.org/archive/eurospeech_2003/e03_3141.html","https://scholar.google.com/scholar?cites=7597890642680008849&as_sdt=2005&sciodt=0,5&hl=en",11,"2020-11-06 21:29:44","","","","",,,,,155,9.12,52,3,17,"Large vocabulary speech recognition systems traditionally represent words in terms of subword units, usually phonemes. This paper investigates the potential of graphemes acting as subunits. In order to develop context dependent grapheme based speech recognizers …"
152,"C Herff, D Heger, A De Pesters, D Telaar…","Brain-to-text: decoding spoken phrases from phone representations in the brain",2015,"Frontiers in …","frontiersin.org","https://www.frontiersin.org/articles/10.3389/fnins.2015.00217/full","https://scholar.google.com/scholar?cites=10373792138042739738&as_sdt=2005&sciodt=0,5&hl=en",12,"2020-11-06 21:29:44","HTML","","","",,,,,152,30.40,30,5,5,"It has long been speculated whether communication between humans and machines based on natural speech related cortical activity is possible. Over the past decade, studies have suggested that it is feasible to recognize isolated aspects of speech from neural signals …"
135,"A Waibel, T Schultz, M Bett, M Denecke…","SMaRT: The smart meeting room task at ISL",2003,"… , Speech, and Signal …","ieeexplore.ieee.org","https://ieeexplore.ieee.org/abstract/document/1202752/?casa_token=SByke-18WPwAAAAA:Vz2QXwXFlYlJQuFa_aVx2Ywtg_Y0JUoSWD97OYqhUUI_rgbbjUfj19awYjr3ei93mB7Qu3F04A","https://scholar.google.com/scholar?cites=11368825063672847323&as_sdt=2005&sciodt=0,5&hl=en",13,"2020-11-06 21:29:44","","","","",,,,,135,7.94,27,5,17,"As computational and communications systems become increasingly smaller, faster, more powerful, and more integrated, the goal of interactive, integrated meeting support rooms is slowly becoming reality. It is already possible, for instance, to rapidly locate task-related …"
128,"K Schaaff, T Schultz","Towards emotion recognition from electroencephalographic signals",2009,"2009 3rd international conference on …","ieeexplore.ieee.org","https://ieeexplore.ieee.org/abstract/document/5349316/?casa_token=Ti5CuPgFFFUAAAAA:Ogv_tFhAGa8aOYyakTXt_oGYFX4ZngZPkpsvoYPzeV8TgE2smHLprUQG0fQfUbABP_cJBICiOg","https://scholar.google.com/scholar?cites=8607040235483190797&as_sdt=2005&sciodt=0,5&hl=en",14,"2020-11-06 21:29:44","","","","",,,,,128,11.64,64,2,11,"During the last decades, information about the emotional state of users has become more and more important in human-computer interaction. Automatic emotion recognition enables the computer to recognize a user's emotional state and thus allows for appropriate reaction …"
132,"L Maier-Hein, F Metze, T Schultz…","Session independent non-audible speech recognition using surface electromyography",2005,"IEEE Workshop on …","ieeexplore.ieee.org","https://ieeexplore.ieee.org/abstract/document/1566521/?casa_token=qAGeePFAfPUAAAAA:gtcUpeRvWbI0rSKNv5pYW8fwC6-38yxuIHhSHvaOGGQqn0uzYIWWYk2ZMrcU9LpYgk8_6I5JTA","https://scholar.google.com/scholar?cites=1887381390932990719&as_sdt=2005&sciodt=0,5&hl=en",15,"2020-11-06 21:29:44","","","","",,,,,132,8.80,33,4,15,"In this paper we introduce a speech recognition system based on myoelectric signals. The system handles audible and non-audible speech. Major challenges in surface electromyography based speech recognition ensue from repositioning electrodes between …"
126,"M Katzenmaier, R Stiefelhagen, T Schultz","Identifying the addressee in human-human-robot interactions based on head pose and speech",2004,"Proceedings of the 6th …","dl.acm.org","https://dl.acm.org/doi/abs/10.1145/1027933.1027959","https://scholar.google.com/scholar?cites=11809324246116493159&as_sdt=2005&sciodt=0,5&hl=en",16,"2020-11-06 21:29:44","","","","",,,,,126,7.88,42,3,16,"In this work we investigate the power of acoustic and visual cues, and their combination, to identify the addressee in a human-human-robot interaction. Based on eighteen audio-visual recordings of two human beings and a (simulated) robot we discriminate the interaction of …"
124,"T Schultz, A Waibel","Fast bootstrapping of LVCSR systems with multilingual phoneme sets",1997,"Fifth European Conference on Speech …","isca-speech.org","https://www.isca-speech.org/archive/eurospeech_1997/e97_0371.html","https://scholar.google.com/scholar?cites=8468342879656285178&as_sdt=2005&sciodt=0,5&hl=en",17,"2020-11-06 21:29:44","","","","",,,,,124,5.39,62,2,23,"In this paper we described an efficient method to bootstrap continuously spoken, large vocabulary speech recognition systems by multilingual phoneme sets. To evaluate this techniques we collected the multilingual database GlobalPhone which currently consists of …"
128,"SC Jou, T Schultz, M Walliczek, F Kraft…","Towards continuous speech recognition using surface electromyography",2006,"… Conference on Spoken …","isca-speech.org","https://www.isca-speech.org/archive/interspeech_2006/i06_1592.html","https://scholar.google.com/scholar?cites=8993131629050403236&as_sdt=2005&sciodt=0,5&hl=en",18,"2020-11-06 21:29:44","","","","",,,,,128,9.14,26,5,14,"We present our research on continuous speech recognition of the surface electromyographic signals that are generated by the human articulatory muscles. Previous research on electromyographic speech recognition was limited to isolated word recognition …"
129,"NT Vu, DC Lyu, J Weiner, D Telaar…","A first speech recognition system for Mandarin-English code-switch conversational speech",2012,"… , Speech and Signal …","ieeexplore.ieee.org","https://ieeexplore.ieee.org/abstract/document/6289015/?casa_token=oXy38VCaIIEAAAAA:cfd6D5Hgj_5o8hz6TulFLFEChZM9TyfECKO72lOoMOX-TcAHVYq2OlNQqhPYtzgWFv9dfzdTOg","https://scholar.google.com/scholar?cites=587982689362947596&as_sdt=2005&sciodt=0,5&hl=en",19,"2020-11-06 21:29:44","","","","",,,,,129,16.13,26,5,8,"This paper presents first steps toward a large vocabulary continuous speech recognition system (LVCSR) for conversational Mandarin-English code-switching (CS) speech. We applied state-of-the-art techniques such as speaker adaptive and discriminative training to …"
112,"T Schultz, A Waibel","Language independent and language adaptive large vocabulary speech recognition",1998,"Fifth International Conference on Spoken …","isca-speech.org","https://www.isca-speech.org/archive/icslp_1998/i98_0577.html","https://scholar.google.com/scholar?cites=12792712254566188893&as_sdt=2005&sciodt=0,5&hl=en",20,"2020-11-06 21:29:44","","","","",,,,,112,5.09,56,2,22,"This paper describes the design of a multilingual speech recognizer using an LVCSR dictation database which has been collected under the project GlobalPhone. This project at the University of Karlsruhe investigates LVCSR systems in 15 languages of the world …"
69,"T Schultz, M Wand, T Hueber…","Biosignal-based spoken communication: A survey",2017,"… on Audio, Speech …","ieeexplore.ieee.org","https://ieeexplore.ieee.org/abstract/document/8114358/?casa_token=Y0qCTClpIXEAAAAA:5C_Fab7hvtH4KRxSKZ35kuVwDwCkXZYchcBKcbThRhekuf7r1r4btyHb_EvBpZQhYwqyq16KVA","https://scholar.google.com/scholar?cites=994726507155754875&as_sdt=2005&sciodt=0,5&hl=en",21,"2020-11-06 21:29:44","","","","",,,,,69,23.00,17,4,3,"Speech is a complex process involving a wide range of biosignals, including but not limited to acoustics. These biosignals-stemming from the articulators, the articulator muscle activities, the neural pathways, and the brain itself-can be used to circumvent limitations of …"
112,"A Waibel, P Geutner, LM Tomokiyo…","Multilinguality in speech and spoken language systems",2000,"Proceedings of the …","ieeexplore.ieee.org","https://ieeexplore.ieee.org/abstract/document/880085/?casa_token=86922tA9cBYAAAAA:RANbdGgScBasHYhdmzmV6UP1F0ZYGruzezPZDRF8Syp5F9a0p7vkf2R9UhDv090ozvvqoi7N0Q","https://scholar.google.com/scholar?cites=10374226289740442627&as_sdt=2005&sciodt=0,5&hl=en",22,"2020-11-06 21:29:44","","","","",,,,,112,5.60,28,4,20,"Building modern speech and language systems currently requires large data resources such as texts, voice recordings, pronunciation lexicons, morphological decomposition information and parsing grammars. Based on a study of the most important differences …"
104,"Q Jin, T Schultz, A Waibel","Far-field speaker recognition",2007,"IEEE Transactions on Audio …","ieeexplore.ieee.org","https://ieeexplore.ieee.org/abstract/document/4291604/?casa_token=Rdnr_WpfMfUAAAAA:nGkeUuWRfOzCcSZ4hsOLLF9GApq4RGRoPMxlwBA6ZpCKNJTjgRhM87iHPpjrWFmcL_i96LIkwA","https://scholar.google.com/scholar?cites=12773873810909881330&as_sdt=2005&sciodt=0,5&hl=en",23,"2020-11-06 21:29:44","","","","",,,,,104,8.00,35,3,13,"In this paper, we study robust speaker recognition in far-field microphone situations. Two approaches are investigated to improve the robustness of speaker recognition in such scenarios. The first approach applies traditional techniques based on acoustic features. We …"
100,"Q Jin, T Schultz","Speaker segmentation and clustering in meetings",2004,"Eighth International Conference on Spoken …","isca-speech.org","https://www.isca-speech.org/archive/interspeech_2004/i04_0597.html","https://scholar.google.com/scholar?cites=1102174428108527677&as_sdt=2005&sciodt=0,5&hl=en",24,"2020-11-06 21:29:44","","","","",,,,,100,6.25,50,2,16,"This paper describes the automatic speaker segmentation and clustering system for natural, multi-speaker meeting conversations based on multiple distant microphones. The system was evaluated in the NIST RT-04S Meeting Recognition Evaluation on the speaker …"
100,"M Woszczyna, N Aoki-Waibel, FD Buo…","JANUS 93: Towards spontaneous speech translation",1994,"… of ICASSP'94. IEEE …","ieeexplore.ieee.org","https://ieeexplore.ieee.org/abstract/document/389285/?casa_token=KoAjNG0lW30AAAAA:PWk4oQUn4r2CvmLVrjqnYbrex9NLmgfPtIpOh7JhtJfwI99KpCVKJDvrUwtBuDcp64Qj4YyQfA","https://scholar.google.com/scholar?cites=12720689163340204641&as_sdt=2005&sciodt=0,5&hl=en",25,"2020-11-06 21:29:44","","","","",,,,,100,3.85,25,4,26,"We present first results from our efforts toward translation of spontaneously spoken speech. Improvements include increasing coverage, robustness, generality and speed of JANUS, the speech-to-speech translation system of Carnegie Mellon and Karlsruhe University. The …"
43,"M Angrick, C Herff, E Mugler, MC Tate…","Speech synthesis from ECoG using densely connected 3D convolutional neural networks",2019,"Journal of neural …","iopscience.iop.org","https://iopscience.iop.org/article/10.1088/1741-2552/ab0c59/meta","https://scholar.google.com/scholar?cites=10130441182290228762&as_sdt=2005&sciodt=0,5&hl=en",26,"2020-11-06 21:29:44","","","","",,,,,43,43.00,9,5,1,"Objective. Direct synthesis of speech from neural signals could provide a fast and natural way of communication to people with neurological diseases. Invasively-measured brain activity (electrocorticography; ECoG) supplies the necessary temporal and spatial resolution …"
95,"YC Tam, T Schultz","Dynamic language model adaptation using variational Bayes inference",2005,"Ninth European Conference on Speech …","isca-speech.org","https://www.isca-speech.org/archive/interspeech_2005/i05_0005.html","https://scholar.google.com/scholar?cites=6529961798072102798&as_sdt=2005&sciodt=0,5&hl=en",27,"2020-11-06 21:29:44","","","","",,,,,95,6.33,48,2,15,"We propose an unsupervised dynamic language model (LM) adaptation framework using long-distance latent topic mixtures. The framework employs the Latent Dirichlet Allocation model (LDA) which models the latent topics of a document collection in an unsupervised …"
96,"S Stuker, T Schultz, F Metze…","Multilingual articulatory features",2003,"2003 IEEE International …","ieeexplore.ieee.org","https://ieeexplore.ieee.org/abstract/document/1198737/?casa_token=Jqyv7qUqWZkAAAAA:vSacRehllVyPwNrE0885uvP3LBAPAP2FVoSM6BebFmY9fpmbw5zDotAR2nmhNG_O_xfJbtYu0Q","https://scholar.google.com/scholar?cites=14109516619667053936&as_sdt=2005&sciodt=0,5&hl=en",28,"2020-11-06 21:29:44","","","","",,,,,96,5.65,24,4,17,"Speech recognition systems based on or aided by articulatory features, such as place and manner of articulation, have been shown to be useful under varying circumstances. Recognizers based on features better compensate channel and noise variability. We show …"
99,"T Schultz, A Waibel","Multilingual and crosslingual speech recognition",1998,"Proc. DARPA Workshop on Broadcast News …","ri.cmu.edu","http://ri.cmu.edu/pub_files/pub1/schultz_tanja_1998_1/schultz_tanja_1998_1.pdf","https://scholar.google.com/scholar?cites=364376280071578293&as_sdt=2005&sciodt=0,5&hl=en",29,"2020-11-06 21:29:44","PDF","","","",,,,,99,4.50,50,2,22,"This paper describes the design of a multilingual speech recognizer using an LVCSR dictation database which has been collected under the project GlobalPhone. This project at the University of Karlsruhe investigates LVCSR systems in 15 languages of the world …"
101,"NT Vu, D Imseng, D Povey, P Motlicek…","Multilingual deep neural network based acoustic modeling for rapid language adaptation",2014,"… on acoustics, speech …","ieeexplore.ieee.org","https://ieeexplore.ieee.org/abstract/document/6855086/?casa_token=IEJWaEDncxwAAAAA:QMN9Fe4X63OKG1nUes5We1YDmY7aU2YE18KzwKoe0-ZwM5rxSLiR6S-1hqk7RXdgV2H_0MGfZw","https://scholar.google.com/scholar?cites=14317728308436745283&as_sdt=2005&sciodt=0,5&hl=en",30,"2020-11-06 21:29:44","","","","",,,,,101,16.83,20,5,6,"This paper presents a study on multilingual deep neural network (DNN) based acoustic modeling and its application to new languages. We investigate the effect of phone merging on multilingual DNN in context of rapid language adaptation. Moreover, the combination of …"
88,"T Schultz, A Waibel","Experiments on cross-language acoustic modeling",2001,"Seventh European Conference on Speech …","isca-speech.org","https://www.isca-speech.org/archive/eurospeech_2001/e01_2721.html","https://scholar.google.com/scholar?cites=3491147597830838686&as_sdt=2005&sciodt=0,5&hl=en",31,"2020-11-06 21:29:44","","","","",,,,,88,4.63,44,2,19,"With the distribution of speech products all over the world, the portability to new target languages becomes a practical concern. As a consequence our research focuses on rapid transfer of LVCSR systems to other languages. In former studies we evaluated the …"
99,"T Schultz, NT Vu, T Schlippe","Globalphone: A multilingual text & speech database in 20 languages",2013,"2013 IEEE International …","ieeexplore.ieee.org","https://ieeexplore.ieee.org/abstract/document/6639248/?casa_token=lY-yy2ZOQtEAAAAA:HUdWhgO_wfmroMqGn4oai7UAnWD33E2Q7FyCVTPlyqpWrgO9RCX53wRJBf5s8uJiVqBZqI1wVw","https://scholar.google.com/scholar?cites=7794480869455737534&as_sdt=2005&sciodt=0,5&hl=en",32,"2020-11-06 21:29:44","","","","",,,,,99,14.14,33,3,7,"This paper describes the advances in the multilingual text and speech database GlobalPhone, a multilingual database of high-quality read speech with corresponding transcriptions and pronunciation dictionaries in 20 languages. GlobalPhone was designed …"
95,"M Georgi, C Amma, T Schultz","Recognizing Hand and Finger Gestures with IMU based Motion and EMG based Muscle Activity Sensing.",2015,"Biosignals","csl.uni-bremen.de","https://www.csl.uni-bremen.de/cms/images/documents/publications/GeorgiAmmaSchultz_RecognizingHandAndFingerGesturesWithIMUBasedMotionAndEMGBasedMuscleActivitySensing.pdf","https://scholar.google.com/scholar?cites=6900803863196401922&as_sdt=2005&sciodt=0,5&hl=en",33,"2020-11-06 21:29:44","PDF","","","",,,,,95,19.00,32,3,5,"Session-and person-independent recognition of hand and finger gestures is of utmost importance for the practicality of gesture based interfaces. In this paper we evaluate the performance of a wearable gesture recognition system that captures arm, hand, and finger …"
87,"K Carki, P Geutner, T Schultz","Turkish LVCSR: towards better speech recognition for agglutinative languages",2000,"2000 IEEE International …","ieeexplore.ieee.org","https://ieeexplore.ieee.org/abstract/document/861971/?casa_token=qzZvIfmGd3MAAAAA:qR81N6NZ1BDHQegmbG1BeovOy8jI2GfpRUqmK1A6O9DQouDbiPt1u_rYIi011HgraJ2HR_BOzQ","https://scholar.google.com/scholar?cites=7439643765576683228&as_sdt=2005&sciodt=0,5&hl=en",34,"2020-11-06 21:29:44","","","","",,,,,87,4.35,29,3,20,"The Turkish language belongs to the Turkic family. All members of this family are close to one another in terms of linguistic structure. Typological similarities are vowel harmony, verb-final word order and agglutinative morphology. This latter property causes a very fast …"
90,"C Amma, M Georgi, T Schultz","Airwriting: Hands-free mobile text input by spotting and continuous recognition of 3D-space handwriting with inertial sensors",2012,"2012 16th International …","ieeexplore.ieee.org","https://ieeexplore.ieee.org/abstract/document/6246142/?casa_token=PVM8OSbRqtAAAAAA:1KHMfqO9PvCN_-rJQ5FoQLvFLImUaQQf3HALClqHLemDTKPorEuJ4WhIRRExTRRyZCee9_bqlw","https://scholar.google.com/scholar?cites=4780500611260912826&as_sdt=2005&sciodt=0,5&hl=en",35,"2020-11-06 21:29:44","","","","",,,,,90,11.25,30,3,8,"We present an input method which enables complex hands-free interaction through 3d handwriting recognition. Users can write text in the air as if they were using an imaginary blackboard. Motion sensing is done wirelessly by accelerometers and gyroscopes which are …"
81,"F Metze, J McDonough, H Soltau, A Waibel, A Lavie…","The NESPOLE! Speech to Speech Translation System",2002,"","hal.inria.fr","https://hal.inria.fr/inria-00326408/","https://scholar.google.com/scholar?cites=3745999261875175170&as_sdt=2005&sciodt=0,5&hl=en",36,"2020-11-06 21:29:44","","","","",,,,,81,4.50,14,6,18,"The main goal of NESPOLE! is to advance the state-of-the-art of speech-to-speech translation in realistic scenarios and involving naive users. The first showcase presented in this demonstration involves an English, French, or German speaking client enquiring about …"
80,"YC Tam, T Schultz","Unsupervised language model adaptation using latent semantic marginals",2006,"Ninth International Conference on Spoken …","isca-speech.org","https://www.isca-speech.org/archive/interspeech_2006/i06_1705.html","https://scholar.google.com/scholar?cites=17938675750916737386&as_sdt=2005&sciodt=0,5&hl=en",37,"2020-11-06 21:29:44","","","","",,,,,80,5.71,40,2,14,"Abstract We integrated the Latent Dirichlet Allocation (LDA) approach, a latent semantic analysis model, into unsupervised language model adaptation framework. We adapted a background language model by minimizing the Kullback-Leibler divergence between the …"
