Cites,Authors,Title,Year,Source,Publisher,ArticleURL,CitesURL,GSRank,QueryDate,Type,DOI,ISSN,CitationURL,Volume,Issue,StartPage,EndPage,ECC,CitesPerYear,CitesPerAuthor,AuthorCount,Age,Abstract
32,"VB Le, L Besacier, T Schultz","Acoustic-phonetic unit similarities for context dependent acoustic model portability",2006,"2006 IEEE International …","ieeexplore.ieee.org","https://ieeexplore.ieee.org/abstract/document/1660217/?casa_token=PekLnDKBevYAAAAA:hPvdSSOheDBM1OfAiv-U4DjvH43wsQ1K7TbC5jWE0OZT-3JdHbSeBsE1XuVzD1oPnfRrVwKEnw","https://scholar.google.com/scholar?cites=9468583261263962152&as_sdt=2005&sciodt=0,5&hl=en",112,"2020-11-06 21:29:44","","","","",,,,,32,2.29,11,3,14,"This paper addresses particularly the use of acoustic-phonetic unit similarities for portability of context dependent acoustic models to new languages. Since the IPA-based method is limited to a source/target phoneme mapping table construction, an estimation method of the …"
32,"K Laskowski, T Schultz","Detection of laughter-in-interaction in multichannel close-talk microphone recordings of meetings",2008,"International Workshop on Machine Learning for …","Springer","https://link.springer.com/chapter/10.1007/978-3-540-85853-9_14","https://scholar.google.com/scholar?cites=12662307182309115383&as_sdt=2005&sciodt=0,5&hl=en",113,"2020-11-06 21:29:44","","","","",,,,,32,2.67,16,2,12,"Laughter is a key element of human-human interaction, occurring surprisingly frequently in multi-party conversation. In meetings, laughter accounts for almost 10% of vocalization effort by time, and is known to be relevant for topic segmentation and the automatic …"
31,"AR Toth, M Wand, T Schultz","Synthesizing speech from electromyography using voice transformation techniques",2009,"Tenth Annual Conference of the …","isca-speech.org","https://www.isca-speech.org/archive/interspeech_2009/i09_0652.html","https://scholar.google.com/scholar?cites=14494004543613947243&as_sdt=2005&sciodt=0,5&hl=en",114,"2020-11-06 21:29:44","","","","",,,,,31,2.82,10,3,11,"Surface electromyography (EMG) can be used to record the activation potentials of articulatory muscles while a person speaks. This technique could enable silent speech interfaces, as EMG signals are generated even when people pantomime speech without …"
30,"K Nakamura, M Janke, M Wand…","Estimation of fundamental frequency from surface electromyographic data: EMG-to-F0",2011,"2011 IEEE International …","ieeexplore.ieee.org","https://ieeexplore.ieee.org/abstract/document/5946468/?casa_token=BQ0ZeH0e8KEAAAAA:OTKnTGco4GyBuzXkyP5pcvrmmUgeIM9S57Gjp2LR_XLdMXPwc_mXLi_7a2sdsJnKMEpFy1TNqA","https://scholar.google.com/scholar?cites=15328355793163871532&as_sdt=2005&sciodt=0,5&hl=en",115,"2020-11-06 21:29:44","","","","",,,,,30,3.33,8,4,9,"In this paper, we present our recent studies of F 0 estimation from the surface electromyographic (EMG) data us ing a Gaussian mixture model (GMM)-based voice con version (VC) technique, referred to as EMG-to-F 0. In our approach, a support vector …"
30,"Q Jin, T Schultz, A Waibel","Phonetic speaker identification",2002,"Seventh International Conference on …","isca-speech.org","https://www.isca-speech.org/archive/icslp_2002/i02_1345.html","https://scholar.google.com/scholar?cites=3198774752780326314&as_sdt=2005&sciodt=0,5&hl=en",116,"2020-11-06 21:29:44","","","","",,,,,30,1.67,10,3,18,"This paper describes the exploration of text-independent speaker identification using novel approaches based on speakers' phonetic features instead of traditional acoustic features. Different phonetic speaker identification approaches are discussed in this paper and …"
30,"M Wand, T Schultz","Towards Speaker-adaptive Speech Recognition based on Surface Electromyography.",2009,"Biosignals","researchgate.net","https://www.researchgate.net/profile/Tanja_Schultz/publication/221333944_Towards_Speaker-adaptive_Speech_Recognition_based_on_Surface_Electromyography/links/547836780cf293e2da286147/Towards-Speaker-adaptive-Speech-Recognition-based-on-Surface-Electromyography.pdf","https://scholar.google.com/scholar?cites=5543332975650804143&as_sdt=2005&sciodt=0,5&hl=en",117,"2020-11-06 21:29:44","PDF","","","",,,,,30,2.73,15,2,11,"We present our recent advances in silent speech interfaces using electromyographic signals that capture the movements of the human articulatory muscles at the skin surface for recognizing continuously spoken speech. Previous systems were limited to speaker-and …"
30,"YC Tam, I Lane, T Schultz","Bilingual-LSA based LM adaptation for spoken language translation",2007,"Proceedings of the 45th Annual Meeting of …","aclweb.org","https://www.aclweb.org/anthology/P07-1066.pdf","https://scholar.google.com/scholar?cites=8688368713783050947&as_sdt=2005&sciodt=0,5&hl=en",118,"2020-11-06 21:29:44","PDF","","","",,,,,30,2.31,10,3,13,"We propose a novel approach to crosslingual language model (LM) adaptation based on bilingual Latent Semantic Analysis (bLSA). A bLSA model is introduced which enables latent topic distributions to be efficiently transferred across languages by enforcing a one-to-one …"
22,"J Weiner, M Engelbart, T Schultz","Manual and Automatic Transcriptions in Dementia Detection from Speech.",2017,"INTERSPEECH","isca-speech.org","https://www.isca-speech.org/archive/Interspeech_2017/pdfs/0112.PDF","https://scholar.google.com/scholar?cites=6426090556107777586&as_sdt=2005&sciodt=0,5&hl=en",119,"2020-11-06 21:29:44","","","","",,,,,22,7.33,7,3,3,"As the population in developed countries is aging, larger numbers of people are at risk of developing dementia. In the near future there will be a need for time-and cost-efficient screening methods. Speech can be recorded and analyzed in this manner, and as speech …"
33,"H Adel, K Kirchhoff, D Telaar, NT Vu…","Features for factored language models for code-switching speech",2014,"… for Under-Resourced …","isca-speech.org","https://www.isca-speech.org/archive/sltu_2014/sl14_032.html","https://scholar.google.com/scholar?cites=2582922842527412686&as_sdt=2005&sciodt=0,5&hl=en",120,"2020-11-06 21:29:44","","","","",,,,,33,5.50,7,5,6,"This paper presents investigations of features which can be used to predict Code-Switching speech. For this task, factored language models are applied and implemented into a state-of-the-art decoder. Different possible factors, such as words, part-of-speech tags, Brown word …"
37,"Q Jin, AR Toth, T Schultz…","Speaker de-identification via voice transformation",2009,"2009 IEEE Workshop on …","ieeexplore.ieee.org","https://ieeexplore.ieee.org/abstract/document/5373356/?casa_token=7XYUWJ0lSLgAAAAA:bd2y58_CT_tG_3DzCutEJ-tuLlCLtGsdLECQ5YkQiu3cQCy6r1eiuALmXpAMg1gm5CYK0_yWeA","https://scholar.google.com/scholar?cites=7393610183660428242&as_sdt=2005&sciodt=0,5&hl=en",121,"2020-11-06 21:29:44","","","","",,,,,37,3.36,9,4,11,"It is a common feature of modern automated voice-driven applications and services to record and transmit a user's spoken request. At the same time, several domains and applications may require keeping the content of the user's request confidential and at the same time …"
28,"M Paulik, S Rao, I Lane, S Vogel…","Sentence segmentation and punctuation recovery for spoken language translation",2008,"2008 IEEE International …","ieeexplore.ieee.org","https://ieeexplore.ieee.org/abstract/document/4518807/?casa_token=OCsL8Rh1WRsAAAAA:-VYKXFLqZrtmIJsKGcTEVSIdvXA-qm0TCOxMpdBzyL6X0nUxDUhOyT2Oc9vmcF3kE4qlQamXjg","https://scholar.google.com/scholar?cites=10094589970582635567&as_sdt=2005&sciodt=0,5&hl=en",122,"2020-11-06 21:29:44","","","","",,,,,28,2.33,6,5,12,"Sentence segmentation and punctuation recovery are critical components for effective spoken language translation (SLT). In this paper we describe our recent work on sentence segmentation and punctuation recovery for three different language pairs, namely for …"
29,"Q Yang, Q Jin, T Schultz","Investigation of cross-show speaker diarization",2011,"Twelfth Annual Conference of the …","isca-speech.org","https://www.isca-speech.org/archive/interspeech_2011/i11_2925.html","https://scholar.google.com/scholar?cites=5245052428183181465&as_sdt=2005&sciodt=0,5&hl=en",123,"2020-11-06 21:29:44","","","","",,,,,29,3.22,10,3,9,"The goal of cross-show diarization is to index speech segments of speakers from a set of shows, with the particular challenge that reappearing speakers across shows have to be labeled with the same speaker identity. In this paper, we introduce three cross-show …"
27,"P Charoenpornsawat, S Hewavitharana…","Thai grapheme-based speech recognition",2006,"Proceedings of the …","aclweb.org","https://www.aclweb.org/anthology/N06-2005.pdf","https://scholar.google.com/scholar?cites=2893382698734358186&as_sdt=2005&sciodt=0,5&hl=en",124,"2020-11-06 21:29:44","PDF","","","",,,,,27,1.93,9,3,14,"In this paper we present the results for building a grapheme-based speech recognition system for Thai. We experiment with different settings for the initial context independent system, different number of acoustic models and different contexts for the speech unit. In …"
29,"Q Jin, T Schultz, A Waibel","Speaker identification using multilingual phone strings",2002,"2002 IEEE International …","ieeexplore.ieee.org","https://ieeexplore.ieee.org/abstract/document/5743675/?casa_token=06jxEhvdq88AAAAA:z-h92kvjV8ocO89GA-RjcvChkLbRMs8Lxd_E2EfKeiFgCHq-1s3XdXCQ6a4EPnf6_QstZRHSrw","https://scholar.google.com/scholar?cites=6140653713312845836&as_sdt=2005&sciodt=0,5&hl=en",125,"2020-11-06 21:29:44","","","","",,,,,29,1.61,10,3,18,"Far-field speaker identification is very challenging since varying recording conditions often result in un-matching training and testing situations. Although the widely used Gaussian Mixture Models (GMM) approach achieves reasonable good results when training and …"
28,"F Stahlberg, T Schlippe, S Vogel…","Word segmentation through cross-lingual word-to-phoneme alignment",2012,"2012 IEEE Spoken …","ieeexplore.ieee.org","https://ieeexplore.ieee.org/abstract/document/6424202/?casa_token=mlq0h9pWuLQAAAAA:NU1igAqYwmfcldzChW38qk_crDPRL-hK9gCfXHY1jbS6kA01xzULwlnVewzAdpbBcql0nYdqeg","https://scholar.google.com/scholar?cites=12108675723852554029&as_sdt=2005&sciodt=0,5&hl=en",126,"2020-11-06 21:29:44","","","","",,,,,28,3.50,7,4,8,"We present our new alignment model Model 3P for cross-lingual word-to-phoneme alignment, and show that unsupervised learning of word segmentation is more accurate when information of another language is used. Word segmentation with cross-lingual …"
26,"C Herff, G Johnson, L Diener, J Shih…","Towards direct speech synthesis from ECoG: A pilot study",2016,"2016 38th Annual …","ieeexplore.ieee.org","https://ieeexplore.ieee.org/abstract/document/7591004/?casa_token=LoXnI0YBEN8AAAAA:9bb1_PYgiypfVUSpp0sSvZyqEVqmUox1uzSr6MKLGpCnLdOaGLjT67SRaMCB4wTcd0lKIrnG9A","https://scholar.google.com/scholar?cites=2771499252263966016&as_sdt=2005&sciodt=0,5&hl=en",127,"2020-11-06 21:29:44","","","","",,,,,26,6.50,5,5,4,"Most current Brain-Computer Interfaces (BCIs) achieve high information transfer rates using spelling paradigms based on stimulus-evoked potentials. Despite the success of this interfaces, this mode of communication can be cumbersome and unnatural. Direct synthesis …"
30,"NT Vu, T Schultz","Multilingual multilayer perceptron for rapid language adaptation between and across language families.",2013,"Interspeech","isca-speech.org","https://www.isca-speech.org/archive/archive_papers/interspeech_2013/i13_0515.pdf","https://scholar.google.com/scholar?cites=1621148971424594501&as_sdt=2005&sciodt=0,5&hl=en",128,"2020-11-06 21:29:44","","","","",,,,,30,4.29,15,2,7,"In this paper, we present our latest investigations of multilingual Multilayer Perceptrons (MLPs) for rapid language adaptation between and across language families. We explore the impact of the amount of languages and data used for the multilingual MLP training …"
26,"A Lavie, F Metze, R Cattoni, E Costantini, S Burger…","A multi-perspective evaluation of the NESPOLE! speech-to-speech translation system",2002,"","hal.inria.fr","https://hal.inria.fr/inria-00326403/","https://scholar.google.com/scholar?cites=11602361925082254113&as_sdt=2005&sciodt=0,5&hl=en",129,"2020-11-06 21:29:44","","","","",,,,,26,1.44,4,6,18,"Performance and usability of realworld speech-to-speech translation systems, like the one developed within the NESPOLE! project, are affected by several aspects that go beyong the pure translation quality provided by the underlying components of the system. In this paper …"
26,"SCS Jou, T Schultz, A Waibel","Continuous electromyographic speech recognition with a multi-stream decoding architecture",2007,"2007 IEEE International …","ieeexplore.ieee.org","https://ieeexplore.ieee.org/abstract/document/4218122/?casa_token=tgwq6cllw8IAAAAA:GTiKfabPTCRkPG73USoo3rfe2nHHlB-x6xri-uh12Q219xP9lDZDnNtwUe_FUI1JiskUkTQwdQ","https://scholar.google.com/scholar?cites=11720137797052343446&as_sdt=2005&sciodt=0,5&hl=en",130,"2020-11-06 21:29:44","","","","",,,,,26,2.00,9,3,13,"In our previous work, we reported a surface electromyographic (EMG) continuous speech recognition system with a novel EMG feature extraction method, E4, which is more robust to EMG noise than traditional spectral features. In this paper, we show that articulatory feature …"
30,"L Diener, M Janke, T Schultz","Direct conversion from facial myoelectric signals to speech using deep neural networks",2015,"2015 International Joint …","ieeexplore.ieee.org","https://ieeexplore.ieee.org/abstract/document/7280404/?casa_token=S1VduH4i_PMAAAAA:u-qzlk_kGZM03vuFkFqBGtg2EfVdC_iTt7B_tjoFR2YcF9lalvafASI8tgeXvcEGk2d5tzr-eQ","https://scholar.google.com/scholar?cites=4816402021850376158&as_sdt=2005&sciodt=0,5&hl=en",131,"2020-11-06 21:29:44","","","","",,,,,30,6.00,10,3,5,"This paper presents our first results using Deep Neural Networks for surface electromyographic (EMG) speech synthesis. The proposed approach enables a direct mapping from EMG signals captured from the articulatory muscle movements to the acoustic …"
25,"M Janke, M Wand, T Schultz","A Spectral Mapping Method for EMG-based Recognition of Silent Speech.",2010,"B-Interface","pdfs.semanticscholar.org","https://pdfs.semanticscholar.org/a49d/e9c32bb52e66578a5c3ca2f9b9e1ca63ca43.pdf","https://scholar.google.com/scholar?cites=13473372022891998684&as_sdt=2005&sciodt=0,5&hl=en",132,"2020-11-06 21:29:44","PDF","","","",,,,,25,2.50,8,3,10,"This paper reports on our latest study on speech recognition based on surface electromyography (EMG). This technology allows for Silent Speech Interfaces since EMG captures the electrical potentials of the human articulatory muscles rather than the acoustic …"
26,"Z Wang, T Schultz","Non-native spontaneous speech recognition through polyphone decision tree specialization",2003,"Eighth European Conference on Speech …","isca-speech.org","https://www.isca-speech.org/archive/eurospeech_2003/e03_1449.html","https://scholar.google.com/scholar?cites=7516810003296968769&as_sdt=2005&sciodt=0,5&hl=en",133,"2020-11-06 21:29:44","","","","",,,,,26,1.53,13,2,17,"With more and more non-native speakers speaking in English, the fast and efficient adaptation to non-native English speech becomes a practical concern. The performance of speech recognition systems is consistently poor on non-native speech. The challenge for …"
27,"D Heger, R Mutter, C Herff, F Putze…","Continuous recognition of affective states by functional near infrared spectroscopy signals",2013,"… Conference on Affective …","ieeexplore.ieee.org","https://ieeexplore.ieee.org/abstract/document/6681548/?casa_token=D1E0o6psQuIAAAAA:20Ezmnn83hCZZ9ktSmdfDmQT6bF_RAyg05UyRT6V3wahQ8FnWskXp9yA9VMctZx0nYW-4o63xw","https://scholar.google.com/scholar?cites=7755149210429184873&as_sdt=2005&sciodt=0,5&hl=en",134,"2020-11-06 21:29:44","","","","",,,,,27,3.86,5,5,7,"Functional near infrared spectroscopy (fNIRS) is becoming more and more popular as an innovative imaging modality for brain computer interfaces. A continuous (ie asynchronous) affective state monitoring system using fNIRS signals would be highly relevant for numerous …"
25,"M Janke, M Wand, T Schultz","Impact of lack of acoustic feedback in EMG-based silent speech recognition",2010,"Eleventh Annual Conference of the …","isca-speech.org","https://www.isca-speech.org/archive/interspeech_2010/i10_2686.html","https://scholar.google.com/scholar?cites=206343125368698352&as_sdt=2005&sciodt=0,5&hl=en",135,"2020-11-06 21:29:44","","","","",,,,,25,2.50,8,3,10,"This paper presents our recent advances in speech recognition based on surface electromyography (EMG). This technology allows for Silent Speech Interfaces since EMG captures the electrical potentials of the human articulatory muscles rather than the acoustic …"
1,"C Botelho, L Diener, D Küster, K Scheck, S Amiriparian…","Toward silent paralinguistics: Speech-to-emg–retrieving articulatory muscle activity from speech",2020,"Small","csl.uni-bremen.de","https://www.csl.uni-bremen.de/cms/images/documents/publications/Interspeech2020_emg_to_speech_revised.pdf","https://scholar.google.com/scholar?cites=5597209961008091754&as_sdt=2005&sciodt=0,5&hl=en",136,"2020-11-06 21:29:44","PDF","","","",,,,,1,1.00,0,6,1,"Electromyographic (EMG) signals recorded during speech production encode information on articulatory muscle activity and also on the facial expression of emotion, thus representing a speech-related biosignal with strong potential for paralinguistic applications …"
24,"Q Jin, Y Pan, T Schultz","Far-field speaker recognition",2006,"2006 IEEE International Conference …","ieeexplore.ieee.org","https://ieeexplore.ieee.org/abstract/document/1660176/?casa_token=WrjjF8aYM1QAAAAA:wHu82fdqzjUb-Num80vu0CYJevzvbovyhqgZvGniT_nt5zMnT29yrt2lWCSeg08t081gQIkJzg","https://scholar.google.com/scholar?cites=1310608884935522089&as_sdt=2005&sciodt=0,5&hl=en",137,"2020-11-06 21:29:44","","","","",,,,,24,1.71,8,3,14,"In this paper we study robust speaker recognition in far-field microphone situations such as meeting scenarios. By applying reverberation compensation and feature warping we achieved significant improvements under mismatched training-testing conditions. To capture …"
24,"A Lavie, F Metze, F Pianesi, S Burger, D Gates, L Levin…","Enhancing the Usability and Performance of NESPOLE!-a Real-World Speech-to-Speech Translation System",2002,"","hal.inria.fr","https://hal.inria.fr/inria-00326412/","https://scholar.google.com/scholar?cites=10455995160624229893&as_sdt=2005&sciodt=0,5&hl=en",138,"2020-11-06 21:29:44","","","","",,,,,24,1.33,3,7,18,"Over the past year, we have developed a fully functional showcase of the NESPOLE! system within the domain of travel and tourism, and have significantly improved system performance and usability based on a series of studies and evaluations wih real users. Our experience …"
26,"H Adel, K Kirchhoff, NT Vu, D Telaar…","Comparing approaches to convert recurrent neural networks into backoff language models for efficient decoding",2014,"… Annual Conference of …","isca-speech.org","https://www.isca-speech.org/archive/interspeech_2014/i14_0651.html","https://scholar.google.com/scholar?cites=9205282701243617184&as_sdt=2005&sciodt=0,5&hl=en",139,"2020-11-06 21:29:44","","","","",,,,,26,4.33,5,5,6,"In this paper, we investigate and compare three different possibilities to convert recurrent neural network language models (RNNLMs) into backoff language models (BNLM). While RNNLMs often outperform traditional n-gram approaches in the task of language modeling …"
25,"D Telaar, M Wand, D Gehrig, F Putze…","BioKIT—real-time decoder for biosignal processing",2014,"… Annual Conference of …","isca-speech.org","https://www.isca-speech.org/archive/interspeech_2014/i14_2650.html","https://scholar.google.com/scholar?cites=3139202818286512636&as_sdt=2005&sciodt=0,5&hl=en",140,"2020-11-06 21:29:44","","","","",,,,,25,4.17,5,5,6,"We introduce BioKIT, a new Hidden Markov Model based toolkit to preprocess, model and interpret biosignals such as speech, motion, muscle and brain activities. The focus of this toolkit is to enable researchers from various communities to pursue their experiments and …"
23,"S Rao, I Lane, T Schultz","Optimizing sentence segmentation for spoken language translation",2007,"Eighth Annual Conference of the …","isca-speech.org","https://www.isca-speech.org/archive/interspeech_2007/i07_2845.html","https://scholar.google.com/scholar?cites=584104365405498093&as_sdt=2005&sciodt=0,5&hl=en",141,"2020-11-06 21:29:44","","","","",,,,,23,1.77,8,3,13,"The conventional approach in text-based machine translation (MT) is to translate complete sentences, which are conveniently indicated by sentence boundary markers. However, since such boundary markers are not available for speech, new methods are required that …"
24,"HA Engelbrecht, T Schultz","Rapid development of an afrikaans-english speech-to-speech translator",2005,"International Workshop on Spoken …","isca-speech.org","https://www.isca-speech.org/archive/iwslt_05/slt5_159.html","https://scholar.google.com/scholar?cites=11431845369167474906&as_sdt=2005&sciodt=0,5&hl=en",142,"2020-11-06 21:29:44","","","","",,,,,24,1.60,12,2,15,"In this paper we investigate the rapid deployment of a twoway Afrikaans to English Speech-to-Speech Translation system. We discuss the approaches and amount of work involved to port a system to a new language pair, ie the steps required to rapidly adapt ASR, MT and …"
23,"M Wand, T Schultz","Pattern learning with deep neural networks in EMG-based speech recognition",2014,"… Conference of the IEEE Engineering in …","ieeexplore.ieee.org","https://ieeexplore.ieee.org/abstract/document/6944550/?casa_token=5285CLfjkKAAAAAA:PlwE9e87ZI4lmXH8H3JHKyej4vpPu8sYGs3jFaPOAscEHX4ktDSm-PrTf79jPT-sDO8i7R3qnQ","https://scholar.google.com/scholar?cites=4489866261819510178&as_sdt=2005&sciodt=0,5&hl=en",143,"2020-11-06 21:29:44","","","","",,,,,23,3.83,12,2,6,"We report on classification of phones and phonetic features from facial electromyographic (EMG) data, within the context of our EMG-based Silent Speech interface. In this paper we show that a Deep Neural Network can be used to perform this classification task, yielding a …"
24,"F Putze, J Hild, R Kärgel, C Herff, A Redmann…","Locating user attention using eye tracking and EEG for spatio-temporal event selection",2013,"Proceedings of the …","dl.acm.org","https://dl.acm.org/doi/abs/10.1145/2449396.2449415","https://scholar.google.com/scholar?cites=769471621677822465&as_sdt=2005&sciodt=0,5&hl=en",144,"2020-11-06 21:29:44","","","","",,,,,24,3.43,4,6,7,"In expert video analysis, the selection of certain events in a continuous video stream is a frequently occurring operation, eg, in surveillance applications. Due to the dynamic and rich visual input, the constantly high attention and the required hand-eye coordination for mouse …"
22,"T Schultz, AW Black","Challenges with rapid adaptation of speech translation systems to new language pairs",2006,"2006 IEEE International Conference on …","ieeexplore.ieee.org","https://ieeexplore.ieee.org/abstract/document/1661500/?casa_token=ehXf7CQurqIAAAAA:9tLkJzTFvTZyJqJ4BSQxeAFVmHiS6__ubgT2WX7nH5QJQvKeoRtqBufWh7ECleYonwuHmM2xMA","https://scholar.google.com/scholar?cites=4195190880948843072&as_sdt=2005&sciodt=0,5&hl=en",145,"2020-11-06 21:29:44","","","","",,,,,22,1.57,11,2,14,"Although we have far from solved the issues in porting speech translation systems to new languages, we have gathered sufficient experience by now to identify a number of major challenges in the process. Although well-defined processes exist for building speech …"
23,"AW Black, T Schultz","Speaker clustering for multilingual synthesis",2006,"Multilingual Speech and Language …","isca-speech.org","https://www.isca-speech.org/archive_open/ml06/ml06_024.html","https://scholar.google.com/scholar?cites=11315551054706491208&as_sdt=2005&sciodt=0,5&hl=en",146,"2020-11-06 21:29:44","","","","",,,,,23,1.64,12,2,14,"Today, speech synthesizers in new languages are typically built by collecting several hours of well recorded speech in the target language. The time and effort involved in collection and correction can be prohibitive when lack of resources is common in addressing under …"
22,"C Fügen, M Westphal, M Schneider, T Schultz…","LingWear: a mobile tourist information system",2001,"Proceedings of the first …","aclweb.org","https://www.aclweb.org/anthology/H01-1048.pdf","https://scholar.google.com/scholar?cites=5258045751036128335&as_sdt=2005&sciodt=0,5&hl=en",147,"2020-11-06 21:29:44","PDF","","","",,,,,22,1.16,4,5,19,"In this aper, we describe LingWear, a mobile tourist information system that allows uninformed users to find their way around in foreign cities and to ask for information about sights, accommodations, and other places of interest. The user can communicate with Lin …"
22,"S Rao, I Lane, T Schultz","Improving spoken language translation by automatic disfluency removal: Evidence from conversational speech transcripts",2007,"Training","Citeseer","http://citeseerx.ist.psu.edu/viewdoc/download?doi=10.1.1.183.511&rep=rep1&type=pdf","https://scholar.google.com/scholar?cites=14321933231327429712&as_sdt=2005&sciodt=0,5&hl=en",148,"2020-11-06 21:29:44","PDF","","","",,,,,22,1.69,7,3,13,"Abstract Machine translation of spoken language has made significant progress in recent years, however, translation quality is still limited due to specific idiosyncrasies of spoken language; including the lack of well-formed sentences and the presence of disfluencies. In …"
