Cites,Authors,Title,Year,Source,Publisher,ArticleURL,CitesURL,GSRank,QueryDate,Type,DOI,ISSN,CitationURL,Volume,Issue,StartPage,EndPage,ECC,CitesPerYear,CitesPerAuthor,AuthorCount,Age,Abstract
11,"R Sarikaya, K Kirchhoff, T Schultz…","Introduction to the special issue on processing morphologically rich languages",2009,"IEEE Transactions on …","ieeexplore.ieee.org","https://ieeexplore.ieee.org/abstract/document/5075779/","https://scholar.google.com/scholar?cites=16302022161884222511&as_sdt=2005&sciodt=0,5&hl=en",225,"2020-11-06 21:29:44","","","","",,,,,11,1.00,3,4,11,"THE past decade has witnessed significant advances in core speech and natural language processing algorithms as well as a continual increase in the amount of linguistic resources. As a consequence, speech and natural language pro- cessing technology (including applications …"
12,"T Schultz, K Kirchhoff","Multilingual acoustic modeling",2006,"Multilingual Speech Processing","","","https://scholar.google.com/scholar?cites=13480518919671442920&as_sdt=2005&sciodt=0,5&hl=en",226,"2020-11-06 21:29:44","CITATION","","","",,,,,12,0.86,6,2,14,""
11,"NT Vu, W Breiter, F Metze, T Schultz","Initialization schemes for multilayer perceptron training and their impact on asr performance using multilingual data",2012,"… Annual Conference of the …","isca-speech.org","https://www.isca-speech.org/archive/interspeech_2012/i12_2586.html","https://scholar.google.com/scholar?cites=3226106332513277726&as_sdt=2005&sciodt=0,5&hl=en",227,"2020-11-06 21:29:44","","","","",,,,,11,1.38,3,4,8,"In this paper we present our latest investigation on initialization schemes for Multilayer Perceptron (MLP) training using multilingual data. We show that the overall performance of a MLP network improves significantly by initializing it with a multilingual MLP. We propose a …"
12,"H Adel, D Telaar, NT Vu, K Kirchhoff…","Combining recurrent neural networks and factored language models during decoding of code-switching speech",2014,"… Annual Conference of …","isca-speech.org","https://www.isca-speech.org/archive/interspeech_2014/i14_1415.html","https://scholar.google.com/scholar?cites=3369120050816265651&as_sdt=2005&sciodt=0,5&hl=en",228,"2020-11-06 21:29:44","","","","",,,,,12,2.00,2,5,6,"In this paper, we present our latest investigations of language modeling for Code-Switching. Since there is only little text material for Code-Switching speech available, we integrate syntactic and semantic features into the language modeling process. In particular, we use …"
2,"D Küster, EG Krumhuber, L Steinert…","Opportunities and challenges for using automatic human affect analysis in consumer research",2020,"Frontiers in …","ncbi.nlm.nih.gov","https://www.ncbi.nlm.nih.gov/pmc/articles/PMC7199103/","https://scholar.google.com/scholar?cites=15075166526644153699&as_sdt=2005&sciodt=0,5&hl=en",229,"2020-11-06 21:29:44","HTML","","","",,,,,2,2.00,1,4,1,"The ability to automatically assess emotional responses via contact-free video recording taps into a rapidly growing market aimed at predicting consumer choices. If consumer attention and engagement are measurable in a reliable and accessible manner, relevant …"
13,"C Amma, TM Schultz","Method and system for handwriting and gesture recognition",2016,"US Patent App. 15/246,639","Google Patents","https://patents.google.com/patent/US20160364010A1/en","https://scholar.google.com/scholar?cites=10282089288513558539&as_sdt=2005&sciodt=0,5&hl=en",230,"2020-11-06 21:29:44","","","","",,,,,13,3.25,7,2,4,"In general, a system can include an interface component configured to receive measurement data from a motion sensor unit physically coupled with a movable part of a body of a user. The measurement data can include sensor data of a sensor of the motion …"
3,"MY Tachbelie, ST Abate, T Schultz","Analysis of globalphone and ethiopian languages speech corpora for multilingual asr",2020,"Proceedings of The 12th Language …","aclweb.org","https://www.aclweb.org/anthology/2020.lrec-1.511/","https://scholar.google.com/scholar?cites=3940517749573960319&as_sdt=2005&sciodt=0,5&hl=en",231,"2020-11-06 21:29:44","","","","",,,,,3,3.00,1,3,1,"In this paper, we present the analysis of GlobalPhone (GP) and speech corpora of Ethiopian languages (Amharic, Tigrigna, Oromo and Wolaytta). The aim of the analysis is to select speech data from GP for the development of multilingual Automatic Speech Recognition …"
11,"M Wand, T Schultz","Speaker-adaptive speech recognition based on surface electromyography",2009,"… Joint Conference on Biomedical Engineering Systems …","Springer","https://link.springer.com/chapter/10.1007/978-3-642-11721-3_21","https://scholar.google.com/scholar?cites=9607476524938765179&as_sdt=2005&sciodt=0,5&hl=en",232,"2020-11-06 21:29:44","","","","",,,,,11,1.00,6,2,11,"We present our recent advances in silent speech interfaces using electromyographic signals that capture the movements of the human articulatory muscles at the skin surface for recognizing continuously spoken speech. Previous systems were limited to speaker-and …"
12,"NT Vu, T Schultz","Exploration of the impact of maximum entropy in recurrent neural network language models for code-switching speech",2014,"Proceedings of The First Workshop on Computational …","aclweb.org","https://www.aclweb.org/anthology/W14-3904.pdf","https://scholar.google.com/scholar?cites=10635567175978228247&as_sdt=2005&sciodt=0,5&hl=en",233,"2020-11-06 21:29:44","PDF","","","",,,,,12,2.00,6,2,6,"This paper presents our latest investigations of the jointly trained maximum entropy and recurrent neural network language models for Code-Switching speech. First, we explore extensively the integration of part-of-speech tags and language identifier information in …"
10,"T Schultz, A Waibel","Development of Multi-lingual Acoustic Models in the GlobalPhone Project",1998,"Proceedings of the 1st Workshop on Text, Speech …","Citeseer","http://citeseerx.ist.psu.edu/viewdoc/download?doi=10.1.1.10.6999&rep=rep1&type=pdf","https://scholar.google.com/scholar?cites=9011297897342492284&as_sdt=2005&sciodt=0,5&hl=en",234,"2020-11-06 21:29:44","PDF","","","",,,,,10,0.45,5,2,22,"This paper describes our recent e ort in developing the GlobalPhone recognizer for multilingual large vocabulary continuous speech. This project investigates LVCSR systems in 15 languages, namely Arabic, Chinese (Mandarin and Wu), Croatian, English, French …"
10,"P Geutner, B Suhm, FD Buø, T Kemp, L Mayfield…","Integrating different learning approaches into a multilingual spoken language translation system",1995,"… Joint Conference on …","Springer","https://link.springer.com/chapter/10.1007/3-540-60925-3_42","https://scholar.google.com/scholar?cites=7240081456567007416&as_sdt=2005&sciodt=0,5&hl=en",235,"2020-11-06 21:29:44","","","","",,,,,10,0.40,2,6,25,"Building multilingual spoken language translation systems requires knowledge about both acoustic models and language models of each language to be translated. Our multilingual translation system JANUS-2 is able to translate English and German spoken input into either …"
11,"YC Tam, T Schultz","Correlated bigram LSA for unsupervised language model adaptation",2009,"Advances in Neural Information Processing …","papers.nips.cc","http://papers.nips.cc/paper/3564-correlated-bigram-lsa-for-unsupervised-language-model-adaptation","https://scholar.google.com/scholar?cites=6769041926700275409&as_sdt=2005&sciodt=0,5&hl=en",236,"2020-11-06 21:29:44","","","","",,,,,11,1.00,6,2,11,"We propose using correlated bigram LSA for unsupervised LM adaptation for automatic speech recognition. The model is trained using efficient variational EM and smoothed using the proposed fractional Kneser-Ney smoothing which handles fractional counts. Our …"
13,"M Wand, A Himmelsbach…","Artifact removal algorithm for an EMG-based Silent Speech Interface",2013,"2013 35th Annual …","ieeexplore.ieee.org","https://ieeexplore.ieee.org/abstract/document/6610857/?casa_token=f0vjqGp4nesAAAAA:SAg15bU_mkRhXKgdcKmTnZZyD1IVQEiHUlwMkFqO_vSCSSdxZEA0aBSylFZgsDiRcpHF_mAQ6Q","https://scholar.google.com/scholar?cites=5269233261043402925&as_sdt=2005&sciodt=0,5&hl=en",237,"2020-11-06 21:29:44","","","","",,,,,13,1.86,4,3,7,"An electromygraphic (EMG) Silent Speech Interface is a system which recognizes speech by capturing the electric potentials of the human articulatory muscles, thus enabling the user to communicate silently. This study deals with improving the EMG signal quality by removing …"
10,"NT Vu, Y Wang, M Klose, Z Mihaylova…","Improving ASR performance on non-native speech using multilingual and crosslingual information",2014,"… Annual Conference of …","isca-speech.org","https://www.isca-speech.org/archive/interspeech_2014/i14_0011.html","https://scholar.google.com/scholar?cites=14589447301876565120&as_sdt=2005&sciodt=0,5&hl=en",238,"2020-11-06 21:29:44","","","","",,,,,10,1.67,2,5,6,"This paper presents our latest investigation of automatic speech recognition (ASR) on non-native speech. We first report on a non-native speech corpus-an extension of the GlobalPhone database-which contains English with Bulgarian, Chinese, German and Indian …"
5,"F Putze, M Salous, T Schultz","Detecting memory-based interaction obstacles with a recurrent neural model of user behavior",2018,"23rd International Conference on …","dl.acm.org","https://dl.acm.org/doi/abs/10.1145/3172944.3173006","https://scholar.google.com/scholar?cites=9840620894694782860&as_sdt=2005&sciodt=0,5&hl=en",239,"2020-11-06 21:29:44","","","","",,,,,5,2.50,2,3,2,"ABSTRACT A memory-based interaction obstacle is a condition which impedes human memory during Human-Computer Interaction, for example a memory-loading secondary task. In this paper, we present an approach to detect the presence of such memory-based …"
1,"L Diener, S Amiriparian, C Botelho…","Towards silent paralinguistics: Deriving speaking mode and speaker ID from electromyographic signals",2020,"Proc …","indico2.conference4me.psnc.pl","https://indico2.conference4me.psnc.pl/event/35/contributions/3549/attachments/1109/1151/Wed-3-3-1.pdf","https://scholar.google.com/scholar?cites=9699671864203866089&as_sdt=2005&sciodt=0,5&hl=en",240,"2020-11-06 21:29:44","PDF","","","",,,,,1,1.00,0,4,1,"Abstract Silent Computational Paralinguistics (SCP)–the assessment of speaker states and traits from non-audibly spoken communication–has rarely been targeted in the rich body of either Computational Paralinguistics or Silent Speech Processing. Here, we provide first …"
8,"M Wand, T Schultz, J Schmidhuber","Domain-Adversarial Training for Session Independent EMG-based Speech Recognition.",2018,"INTERSPEECH","isca-speech.org","https://www.isca-speech.org/archive/Interspeech_2018/pdfs/2318.pdf","https://scholar.google.com/scholar?cites=17323112853041956871&as_sdt=2005&sciodt=0,5&hl=en",241,"2020-11-06 21:29:44","","","","",,,,,8,4.00,3,3,2,"We present our research on continuous speech recognition based on Surface Electromyography (EMG), where speech information is captured by electrodes attached to the speaker's face. This method allows speech processing without requiring that an acoustic …"
9,"YC Tam, T Schultz","Bilingual LSA-based translation lexicon adaptation for spoken language translation",2007,"Eighth Annual Conference of the International …","isca-speech.org","https://www.isca-speech.org/archive/interspeech_2007/i07_2461.html","https://scholar.google.com/scholar?cites=16051567459155293211&as_sdt=2005&sciodt=0,5&hl=en",242,"2020-11-06 21:29:44","","","","",,,,,9,0.69,5,2,13,"We present a bilingual LSA (bLSA) framework for translation lexicon adaptation. The idea is to apply marginal adaptation on a translation lexicon so that the lexicon marginals match to indomain marginals. In the framework of speech translation, the bLSA method transfers topic …"
9,"D Heger, F Putze, T Schultz","An adaptive information system for an empathic robot using EEG data",2010,"International Conference on Social Robotics","Springer","https://link.springer.com/chapter/10.1007/978-3-642-17248-9_16","https://scholar.google.com/scholar?cites=10983484833111975836&as_sdt=2005&sciodt=0,5&hl=en",243,"2020-11-06 21:29:44","","","","",,,,,9,0.90,3,3,10,"In this paper we introduce a speech-based information system for a humanoid robot that is able to adapt its information presentation strategy to different brain patterns of its user. Brain patterns are classified from electroencephalographic (EEG) signals and correspond to …"
9,"R Hsiao, T Schultz","Generalized Baum-Welch algorithm and its implication to a new extended Baum-Welch algorithm",2011,"Twelfth Annual Conference of the International …","isca-speech.org","https://www.isca-speech.org/archive/interspeech_2011/i11_0773.html","https://scholar.google.com/scholar?cites=6519570309074636763&as_sdt=2005&sciodt=0,5&hl=en",244,"2020-11-06 21:29:44","","","","",,,,,9,1.00,5,2,9,"This paper describes how we can use the generalized Baum-Welch (GBW) algorithm to develop better extended Baum-Welch (EBW) algorithms. Based on GBW, we show that the backoff term in the EBW algorithm comes from KL-divergence which is used as a …"
9,"T Heistermann, M Janke, M Wand, T Schultz","Spatial Artifact Detection for Multi-channel EMG-based Speech Recognition.",2014,"BIOSIGNALS","scitepress.org","https://www.scitepress.org/papers/2014/47939/47939.pdf","https://scholar.google.com/scholar?cites=8814790083481215738&as_sdt=2005&sciodt=0,5&hl=en",245,"2020-11-06 21:29:44","PDF","","","",,,,,9,1.50,2,4,6,"We introduce a spatial artifact detection method for a surface electromyography (EMG) based speech recognition system. The EMG signals are recorded using grid-shaped electrode arrays affixed to the speakers face. Continuous speech recognition is performed …"
9,"T Schultz","Multilinguale Spracherkennung",2000,"Kombination akustischer Modelle zur Portierung auf …","","","https://scholar.google.com/scholar?cites=13819914434114144339&as_sdt=2005&sciodt=0,5&hl=en",246,"2020-11-06 21:29:44","CITATION","","","",,,,,9,0.45,9,1,20,""
10,"B Zhao, T Schultz","Toward robust parametric trajectory segmental model for vowel recognition",2002,"IEEE INTERNATIONAL CONFERENCE ON …","Citeseer","http://citeseerx.ist.psu.edu/viewdoc/download?doi=10.1.1.65.1553&rep=rep1&type=pdf","https://scholar.google.com/scholar?cites=11655238904017843130&as_sdt=2005&sciodt=0,5&hl=en",247,"2020-11-06 21:29:44","PDF","","","",,,,,10,0.56,5,2,18,"In this paper we present a robust and discriminative segmental trajectory modeling for vowel recognition. We proposed two new approaches. One is using weighted least square estimation for the parametric trajectory parameter, which gives a much more robust …"
9,"F Putze, T Schultz","Cognitive memory modeling for interactive systems in dynamic environments",2009,"International Workshop Series on …","pdfs.semanticscholar.org","https://pdfs.semanticscholar.org/a22c/f4c5af4f6c0f24219d84d5c9e15c751e27a8.pdf","https://scholar.google.com/scholar?cites=14766132009152018605&as_sdt=2005&sciodt=0,5&hl=en",248,"2020-11-06 21:29:44","PDF","","","",,,,,9,0.82,5,2,11,"This paper presents our ongoing work on cognitive modeling components designed for applications in adaptive dialog systems for dynamic environments. We believe that insight into which information the user currently processes is necessary to build dialog systems that …"
9,"D Rebelo, C Amma, H Gamboa, T Schultz","Human Activity Recognition for an Intelligent Knee Orthosis.",2013,"BIOSIGNALS","scitepress.org","https://scitepress.org/papers/2013/42549/42549.pdf","https://scholar.google.com/scholar?cites=11863465876862021612&as_sdt=2005&sciodt=0,5&hl=en",249,"2020-11-06 21:29:44","PDF","","","",,,,,9,1.29,2,4,7,"This paper investigates the possibility to classify isolated human activities from biosignal sensors integrated into a knee orthosis. An intelligent orthosis that is capable to recognize its wearers activity would be able to adapt itself to the users situation for enhanced comfort. We …"
9,"A Kurematsu, Y Akegami, S Burger…","Verbmobil dialogues: Multifaced analysis",2000,"… on Spoken Language …","isca-speech.org","https://www.isca-speech.org/archive/archive_papers/icslp_2000/i00_4712.pdf","https://scholar.google.com/scholar?cites=10935001708625790684&as_sdt=2005&sciodt=0,5&hl=en",250,"2020-11-06 21:29:44","","","","",,,,,9,0.45,2,4,20,"This paper describes the outline of collecting and transcribing spontaneous spoken dialogues for VERBMOBIL, the German research project on multilingual processing of spontaneous speech. The method and conditions of data collection performed using the …"
8,"M Wand, SCS Jou, T Schultz","Wavelet-based front-end for electromyographic speech recognition",2007,"Eighth Annual Conference of the …","isca-speech.org","https://www.isca-speech.org/archive/interspeech_2007/i07_0686.html","https://scholar.google.com/scholar?cites=16664837013489756911&as_sdt=2005&sciodt=0,5&hl=en",251,"2020-11-06 21:29:44","","","","",,,,,8,0.62,3,3,13,"In this paper we present our investigations on the potential of wavelet-based preprocessing for surface electromyographic speech recognition. We implemented several variants of the Discrete Wavelet Transform and applied them to electromyographical data. First we …"
9,"F Stahlberg, T Schlippe, S Vogel, T Schultz","Word segmentation and pronunciation extraction from phoneme sequences through cross-lingual word-to-phoneme alignment",2016,"Computer Speech & …","Elsevier","https://www.sciencedirect.com/science/article/pii/S0885230814000977","https://scholar.google.com/scholar?cites=4792603259529004322&as_sdt=2005&sciodt=0,5&hl=en",252,"2020-11-06 21:29:44","","","","",,,,,9,2.25,2,4,4,"In this paper, we study methods to discover words and extract their pronunciations from audio data for non-written and under-resourced languages. We examine the potential and the challenges of pronunciation extraction from phoneme sequences through cross-lingual …"
8,"S Leidig, T Schlippe, T Schultz","Automatic detection of anglicisms for the pronunciation dictionary generation: a case study on our German IT corpus",2014,"Spoken Language Technologies …","isca-speech.org","https://www.isca-speech.org/archive/sltu_2014/sl14_207.html","https://scholar.google.com/scholar?cites=4301562999119143135&as_sdt=2005&sciodt=0,5&hl=en",253,"2020-11-06 21:29:44","","","","",,,,,8,1.33,3,3,6,"With the globalization more and more words from other languages come into a language without assimilation to the phonetic system of the new language. To economically build up lexical resources with automatic or semi-automatic methods, it is important to detect and …"
8,"J Kominek, T Schultz, AW Black","Voice building from insufficient data-classroom experiences with web-based language development tools.",2007,"SSW","cs.cmu.edu","https://www.cs.cmu.edu/afs/cs.cmu.edu/Web/People/awb/papers/ssw6/ssw6_322.pdf","https://scholar.google.com/scholar?cites=3117273626428948436&as_sdt=2005&sciodt=0,5&hl=en",254,"2020-11-06 21:29:44","PDF","","","",,,,,8,0.62,3,3,13,"To make the goal of building voices in new languages easier and more accessible to non-experts, the combined tasks of phoneme set definition, text selection, prompt recording, lexicon building, and voice creation in Festival are now integrated behind a web-based …"
8,"M Wand, M Janke, T Schultz","Decision-tree based Analysis of Speaking Mode Discrepancies in EMG-based Speech Recognition.",2012,"BIOSIGNALS","scitepress.org","https://www.scitepress.org/Papers/2012/37872/37872.pdf","https://scholar.google.com/scholar?cites=3543761512637152177&as_sdt=2005&sciodt=0,5&hl=en",255,"2020-11-06 21:29:44","PDF","","","",,,,,8,1.00,3,3,8,"This study is concerned with the impact of speaking mode variabilities on speech recognition by surface electromyography (EMG). In EMG-based speech recognition, we capture the electric potentials of the human articulatory muscles by surface electrodes, so …"
3,"MY Tachbelie, A Abulimiti, ST Abate…","Dnn-based speech recognition for globalphone languages",2020,"ICASSP 2020-2020 …","ieeexplore.ieee.org","https://ieeexplore.ieee.org/abstract/document/9053144/?casa_token=WHYMn_9WsDIAAAAA:G65BJJdFQM4SVsi8phpJgZ9fxM-V4KowWZetNAj6xpSd4woIksGEPsBphZCEOAoh-8EIbFc3ew","https://scholar.google.com/scholar?cites=12787073622949353673&as_sdt=2005&sciodt=0,5&hl=en",256,"2020-11-06 21:29:44","","","","",,,,,3,3.00,1,4,1,"This paper describes new reference benchmark results based on hybrid Hidden Markov Model and Deep Neural Networks (HMM-DNN) for the GlobalPhone (GP) multilingual text and speech database. GP is a multilingual database of high-quality read speech with …"
1,"S Manghat, S Manghat, T Schultz","Malayalam-English Code-Switched: Grapheme to Phoneme System",2020,"Proc. Interspeech 2020","isca-speech.org","https://isca-speech.org/archive/Interspeech_2020/pdfs/1936.pdf","https://scholar.google.com/scholar?cites=9336354185655845479&as_sdt=2005&sciodt=0,5&hl=en",257,"2020-11-06 21:29:44","","","","",,,,,1,1.00,0,3,1,"Grapheme to phoneme conversion is an integral aspect of speech processing. Conversational speech in Malayalam–a low resource Indic language has inter-sentential, intrasentential code-switching as well as frequent intra-word codeswitching with English …"
0,"F Putze, T Ihrig, T Schultz, W Stuerzlinger","Platform for Studying Self-Repairing Auto-Corrections in Mobile Text Entry based on Brain Activity, Gaze, and Context",2020,"Proceedings of the 2020 CHI …","dl.acm.org","https://dl.acm.org/doi/abs/10.1145/3313831.3376815","",258,"2020-11-06 21:29:44","","","","",,,,,0,0.00,0,4,1,"Auto-correction is a standard feature of mobile text entry. While the performance of state-of-the-art auto-correct methods is usually relatively high, any errors that occur are cumbersome to repair, interrupt the flow of text entry, and challenge the user's agency over the process. In …"
2,"C Frankenberg, J Weiner, T Schultz, M Knebel…","Perplexity–a new predictor of cognitive changes in spoken language?–results of the Interdisciplinary Longitudinal Study on Adult Development and Aging (ILSE)",2019,"Linguistics …","degruyter.com","https://www.degruyter.com/downloadpdf/journals/lingvan/5/s2/article-20180026.xml","https://scholar.google.com/scholar?cites=13990215037981912659&as_sdt=2005&sciodt=0,5&hl=en",259,"2020-11-06 21:29:44","","","","",,,,,2,2.00,0,5,1,"In addition to memory loss, progressive deterioration of speech and language skills is among the main symptoms at the onset of Alzheimer's disease (AD) as well as in mild cognitive impairment (MCI). Detailed interview analyses demonstrated early symptoms …"
7,"F Putze, M Scherer, T Schultz","Starring into the void? Classifying Internal vs. External Attention from EEG",2016,"… of the 9th Nordic Conference on Human …","dl.acm.org","https://dl.acm.org/doi/abs/10.1145/2971485.2971555","https://scholar.google.com/scholar?cites=6996296008590104824&as_sdt=2005&sciodt=0,5&hl=en",260,"2020-11-06 21:29:44","","","","",,,,,7,1.75,2,3,4,"For any HCI system, it would be a great advantage if it was aware of the attentional state of its user: Is he or she paying attention to external stimuli provided by the user's environment or is the user focusing his or her attention on internal mental tasks? In this paper, we …"
8,"SE Navarro, F Heger, F Putze, T Beyl…","Telemanipulation with force-based display of proximity fields",2015,"2015 IEEE/RSJ …","ieeexplore.ieee.org","https://ieeexplore.ieee.org/abstract/document/7354027/","https://scholar.google.com/scholar?cites=2341109882181049787&as_sdt=2005&sciodt=0,5&hl=en",261,"2020-11-06 21:29:44","","","","",,,,,8,1.60,2,5,5,"In this paper we show and evaluate the design of a novel telemanipulation system that maps proximity values, acquired inside of a gripper, to forces a user can feel through a haptic input device. The command console is complemented by input-devices that give the user an …"
11,"C Herff, L Diener, M Angrick, E Mugler…","Generating Natural, Intelligible Speech From Brain Activity in Motor, Premotor, and Inferior Frontal Cortices",2019,"Frontiers in …","frontiersin.org","https://www.frontiersin.org/articles/10.3389/fnins.2019.01267/full?utm_source=S-TWT&utm_medium=SNET&utm_campaign=ECO_FNINS_XXXXXXXX_auto-dlvrit","https://scholar.google.com/scholar?cites=4902202305552040683&as_sdt=2005&sciodt=0,5&hl=en",262,"2020-11-06 21:29:44","HTML","","","",,,,,11,11.00,2,5,1,"Neural interfaces that directly produce intelligible speech from brain activity would allow people with severe impairment from neurological disorders to communicate more naturally. Here, we record neural population activity in motor, premotor and inferior frontal cortices …"
5,"L Diener, T Schultz","Investigating Objective Intelligibility in Real-Time EMG-to-Speech Conversion.",2018,"INTERSPEECH","csl.uni-bremen.de","https://csl.uni-bremen.de/cms/images/documents/publications/IS2018_EMG_Realtime.pdf","https://scholar.google.com/scholar?cites=11922971226098683141&as_sdt=2005&sciodt=0,5&hl=en",263,"2020-11-06 21:29:44","PDF","","","",,,,,5,2.50,3,2,2,"This paper presents an analysis of the influence of various system parameters on the output quality of our neural network based real-time EMG-to-Speech conversion system. This EMG-to-Speech system allows for the direct conversion of facial surface electromyographic …"
